{
    "seed": "How quality assurance localization affect gamers around the world?",
    "output": "output/instagram/ideas/2023-12-09-21-57-22-how-quality-assurance-localization-affect-gamers-around-the-world",
    "ideas": [
        {
            "first_page": {
                "image": "https://example.com/gamer_image.jpg",
                "image_alt": "Image of a gamer playing video games",
                "title": "The Impact of Quality Assurance Localization on Gamers Worldwide"
            },
            "pages": [
                {
                    "image": "https://example.com/localization_image.jpg",
                    "image_alt": "Image of a world map with localized icons",
                    "title": "What is Quality Assurance Localization?",
                    "text": "Quality Assurance Localization is the process of adapting video games to specific regions or languages, ensuring that gamers worldwide can enjoy games in their native language. It involves translating text, adjusting cultural references, and modifying gameplay elements to suit different markets.",
                    "footer": "Source: Game Localization: Translating for the Global Digital Entertainment Industry"
                },
                {
                    "image": "https://example.com/benefits_image.jpg",
                    "image_alt": "Image of gamers from different countries playing together",
                    "title": "Benefits of Quality Assurance Localization",
                    "text": "1. Enhanced Player Experience: By localizing games, developers can provide a more immersive experience for gamers. They can understand the storyline, dialogues, and instructions without language barriers.\n\n2. Increased Market Reach: Localization allows games to reach a wider audience globally. It opens up new markets and increases the potential for revenue generation.\n\n3. Cultural Sensitivity: Adapting games to different cultures helps avoid offensive or inappropriate content. It ensures that games respect local customs, beliefs, and sensitivities.\n\n4. Competitive Advantage: Games that are well-localized have a competitive edge over those that are not. Gamers are more likely to choose a game that caters to their language and cultural preferences.",
                    "footer": "Source: The Localization Handbook: A Guide to Translating for the Global Market"
                },
                {
                    "image": "https://example.com/impact_image.jpg",
                    "image_alt": "Image of a gamer expressing happiness",
                    "title": "The Impact on Gamers",
                    "text": "Quality Assurance Localization has a significant impact on gamers worldwide:\n\n1. Inclusive Gaming: Localization allows gamers from different countries to connect and play together, fostering a sense of inclusivity and community.\n\n2. Access to Diverse Content: Gamers can enjoy a wide variety of games from different cultures and regions, expanding their gaming experiences.\n\n3. Better Understanding: Localization helps gamers understand the nuances of a game, including cultural references and humor, leading to a more enjoyable and immersive experience.\n\n4. Increased Engagement: When gamers can fully comprehend the game's content, they are more likely to engage with it for longer periods, leading to higher player retention and satisfaction.",
                    "footer": "Source: The Game Localization Handbook: Second Edition"
                },
                {
                    "image": "https://example.com/future_image.jpg",
                    "image_alt": "Image of futuristic technology",
                    "title": "The Future of Quality Assurance Localization",
                    "text": "As the gaming industry continues to grow globally, the importance of Quality Assurance Localization will only increase. Advancements in technology, such as machine translation and AI, will streamline the localization process, making it more efficient and cost-effective. Additionally, the demand for localization in emerging markets, such as China and India, will drive further innovation in this field.",
                    "footer": "Source: The Localization Handbook: A Guide to Translating for the Global Market"
                }
            ],
            "keywords": [
                "#gaming",
                "#localization",
                "#gamers",
                "#qualityassurance",
                "#videogames",
                "#inclusivity"
            ]
        }
    ],
    "posts": [
        {
            "first_page": "output\\instagram\\ideas\\2023-12-09-21-57-22-how-quality-assurance-localization-affect-gamers-around-the-world\\idea-0-page-0-post.png",
            "pages": [
                "output\\instagram\\ideas\\2023-12-09-21-57-22-how-quality-assurance-localization-affect-gamers-around-the-world\\idea-0-page-1-post.png",
                "output\\instagram\\ideas\\2023-12-09-21-57-22-how-quality-assurance-localization-affect-gamers-around-the-world\\idea-0-page-2-post.png",
                "output\\instagram\\ideas\\2023-12-09-21-57-22-how-quality-assurance-localization-affect-gamers-around-the-world\\idea-0-page-3-post.png",
                "output\\instagram\\ideas\\2023-12-09-21-57-22-how-quality-assurance-localization-affect-gamers-around-the-world\\idea-0-page-4-post.png"
            ]
        }
    ],
    "summary": [
        [
            "The Impact of Quality Assurance Localization on Gamers Worldwide\nhttps://example.com/gamer_image.jpg\nImage of a gamer playing video games\n\nWhat is Quality Assurance Localization?\nQuality Assurance Localization is the process of adapting video games to specific regions or languages, ensuring that gamers worldwide can enjoy games in their native language. It involves translating text, adjusting cultural references, and modifying gameplay elements to suit different markets.\nhttps://example.com/localization_image.jpg\nImage of a world map with localized icons\nSource: Game Localization: Translating for the Global Digital Entertainment Industry\n\nBenefits of Quality Assurance Localization\n1. Enhanced Player Experience: By localizing games, developers can provide a more immersive experience for gamers. They can understand the storyline, dialogues, and instructions without language barriers.\n\n2. Increased Market Reach: Localization allows games to reach a wider audience globally. It opens up new markets and increases the potential for revenue generation.\n\n3. Cultural Sensitivity: Adapting games to different cultures helps avoid offensive or inappropriate content. It ensures that games respect local customs, beliefs, and sensitivities.\n\n4. Competitive Advantage: Games that are well-localized have a competitive edge over those that are not. Gamers are more likely to choose a game that caters to their language and cultural preferences.\nhttps://example.com/benefits_image.jpg\nImage of gamers from different countries playing together\nSource: The Localization Handbook: A Guide to Translating for the Global Market\n\nThe Impact on Gamers\nQuality Assurance Localization has a significant impact on gamers worldwide:\n\n1. Inclusive Gaming: Localization allows gamers from different countries to connect and play together, fostering a sense of inclusivity and community.\n\n2. Access to Diverse Content: Gamers can enjoy a wide variety of games from different cultures and regions, expanding their gaming experiences.\n\n3. Better Understanding: Localization helps gamers understand the nuances of a game, including cultural references and humor, leading to a more enjoyable and immersive experience.\n\n4. Increased Engagement: When gamers can fully comprehend the game's content, they are more likely to engage with it for longer periods, leading to higher player retention and satisfaction.\nhttps://example.com/impact_image.jpg\nImage of a gamer expressing happiness\nSource: The Game Localization Handbook: Second Edition\n\nThe Future of Quality Assurance Localization\nAs the gaming industry continues to grow globally, the importance of Quality Assurance Localization will only increase. Advancements in technology, such as machine translation and AI, will streamline the localization process, making it more efficient and cost-effective. Additionally, the demand for localization in emerging markets, such as China and India, will drive further innovation in this field.\nhttps://example.com/future_image.jpg\nImage of futuristic technology\nSource: The Localization Handbook: A Guide to Translating for the Global Market\n\n\n#gaming, #localization, #gamers, #qualityassurance, #videogames, #inclusivity\n"
        ]
    ]
}