{
    "seed": "How home-care based agencies impact society and the economy?",
    "output": "output/instagram/ideas/2023-12-09-21-48-05-how-home-care-based-agencies-impact-society-and-the-economy",
    "ideas": [
        {
            "first_page": {
                "image": "https://example.com/homecare-agencies-image.jpg",
                "image_alt": "Image of a caregiver assisting an elderly person at home",
                "title": "The Impact of Home Care Agencies on Society and the Economy"
            },
            "pages": [
                {
                    "image": "https://example.com/homecare-agencies-image1.jpg",
                    "image_alt": "Image of a diverse group of caregivers providing care",
                    "title": "1. Providing Personalized Care",
                    "text": "Home care agencies play a crucial role in society by providing personalized care to individuals in the comfort of their own homes. Caregivers assist with activities of daily living, medication management, and even emotional support. This personalized care allows individuals to maintain their independence and improve their quality of life.",
                    "footer": "Source: National Association for Home Care & Hospice"
                },
                {
                    "image": "https://example.com/homecare-agencies-image2.jpg",
                    "image_alt": "Image of a caregiver assisting a senior with meal preparation",
                    "title": "2. Reducing Healthcare Costs",
                    "text": "By providing care at home, home care agencies help reduce healthcare costs. Studies have shown that individuals who receive home care services have lower hospital readmission rates and fewer emergency room visits. This not only improves the overall health outcomes for individuals but also reduces the burden on healthcare systems and saves money.",
                    "footer": "Source: Journal of the American Geriatrics Society"
                },
                {
                    "image": "https://example.com/homecare-agencies-image3.jpg",
                    "image_alt": "Image of a caregiver assisting a person with mobility aids",
                    "title": "3. Job Creation and Economic Impact",
                    "text": "Home care agencies contribute to job creation and have a significant economic impact. These agencies employ a large number of caregivers, creating employment opportunities in the healthcare sector. Additionally, the services provided by home care agencies generate revenue and contribute to the overall economy.",
                    "footer": "Source: Home Care Association of America"
                },
                {
                    "image": "https://example.com/homecare-agencies-image4.jpg",
                    "image_alt": "Image of a caregiver providing companionship to a senior",
                    "title": "4. Promoting Aging in Place",
                    "text": "Home care agencies enable aging in place, allowing individuals to remain in their own homes as they age. This not only enhances their sense of independence and dignity but also reduces the need for institutional care, such as nursing homes. Aging in place has been shown to have numerous physical, emotional, and social benefits for seniors.",
                    "footer": "Source: AARP"
                },
                {
                    "image": "https://example.com/homecare-agencies-image5.jpg",
                    "image_alt": "Image of a caregiver assisting a person with medication management",
                    "title": "5. Supporting Family Caregivers",
                    "text": "Home care agencies provide support to family caregivers who often bear the responsibility of caring for their loved ones. These agencies offer respite care, allowing family caregivers to take a break and recharge. By sharing the caregiving responsibilities, home care agencies help prevent caregiver burnout and ensure the well-being of both the caregiver and the care recipient.",
                    "footer": "Source: Family Caregiver Alliance"
                },
                {
                    "image": "https://example.com/homecare-agencies-image6.jpg",
                    "image_alt": "Image of a caregiver assisting a person with physical therapy exercises",
                    "title": "6. Enhancing Overall Well-being",
                    "text": "Home care agencies not only focus on physical care but also prioritize the overall well-being of individuals. Caregivers provide companionship, engage in meaningful activities, and promote mental and emotional well-being. This holistic approach to care contributes to improved quality of life and happiness.",
                    "footer": "Source: American Society on Aging"
                }
            ],
            "keywords": [
                "#homecare",
                "#caregivers",
                "#aginginplace",
                "#healthcare",
                "#economy",
                "#wellbeing"
            ]
        }
    ],
    "posts": [
        {
            "first_page": "output\\instagram\\ideas\\2023-12-09-21-48-05-how-home-care-based-agencies-impact-society-and-the-economy\\idea-0-page-0-post.png",
            "pages": [
                "output\\instagram\\ideas\\2023-12-09-21-48-05-how-home-care-based-agencies-impact-society-and-the-economy\\idea-0-page-1-post.png",
                "output\\instagram\\ideas\\2023-12-09-21-48-05-how-home-care-based-agencies-impact-society-and-the-economy\\idea-0-page-2-post.png",
                "output\\instagram\\ideas\\2023-12-09-21-48-05-how-home-care-based-agencies-impact-society-and-the-economy\\idea-0-page-3-post.png",
                "output\\instagram\\ideas\\2023-12-09-21-48-05-how-home-care-based-agencies-impact-society-and-the-economy\\idea-0-page-4-post.png",
                "output\\instagram\\ideas\\2023-12-09-21-48-05-how-home-care-based-agencies-impact-society-and-the-economy\\idea-0-page-5-post.png",
                "output\\instagram\\ideas\\2023-12-09-21-48-05-how-home-care-based-agencies-impact-society-and-the-economy\\idea-0-page-6-post.png"
            ]
        }
    ],
    "summary": [
        [
            "The Impact of Home Care Agencies on Society and the Economy\nhttps://example.com/homecare-agencies-image.jpg\nImage of a caregiver assisting an elderly person at home\n\n1. Providing Personalized Care\nHome care agencies play a crucial role in society by providing personalized care to individuals in the comfort of their own homes. Caregivers assist with activities of daily living, medication management, and even emotional support. This personalized care allows individuals to maintain their independence and improve their quality of life.\nhttps://example.com/homecare-agencies-image1.jpg\nImage of a diverse group of caregivers providing care\nSource: National Association for Home Care & Hospice\n\n2. Reducing Healthcare Costs\nBy providing care at home, home care agencies help reduce healthcare costs. Studies have shown that individuals who receive home care services have lower hospital readmission rates and fewer emergency room visits. This not only improves the overall health outcomes for individuals but also reduces the burden on healthcare systems and saves money.\nhttps://example.com/homecare-agencies-image2.jpg\nImage of a caregiver assisting a senior with meal preparation\nSource: Journal of the American Geriatrics Society\n\n3. Job Creation and Economic Impact\nHome care agencies contribute to job creation and have a significant economic impact. These agencies employ a large number of caregivers, creating employment opportunities in the healthcare sector. Additionally, the services provided by home care agencies generate revenue and contribute to the overall economy.\nhttps://example.com/homecare-agencies-image3.jpg\nImage of a caregiver assisting a person with mobility aids\nSource: Home Care Association of America\n\n4. Promoting Aging in Place\nHome care agencies enable aging in place, allowing individuals to remain in their own homes as they age. This not only enhances their sense of independence and dignity but also reduces the need for institutional care, such as nursing homes. Aging in place has been shown to have numerous physical, emotional, and social benefits for seniors.\nhttps://example.com/homecare-agencies-image4.jpg\nImage of a caregiver providing companionship to a senior\nSource: AARP\n\n5. Supporting Family Caregivers\nHome care agencies provide support to family caregivers who often bear the responsibility of caring for their loved ones. These agencies offer respite care, allowing family caregivers to take a break and recharge. By sharing the caregiving responsibilities, home care agencies help prevent caregiver burnout and ensure the well-being of both the caregiver and the care recipient.\nhttps://example.com/homecare-agencies-image5.jpg\nImage of a caregiver assisting a person with medication management\nSource: Family Caregiver Alliance\n\n6. Enhancing Overall Well-being\nHome care agencies not only focus on physical care but also prioritize the overall well-being of individuals. Caregivers provide companionship, engage in meaningful activities, and promote mental and emotional well-being. This holistic approach to care contributes to improved quality of life and happiness.\nhttps://example.com/homecare-agencies-image6.jpg\nImage of a caregiver assisting a person with physical therapy exercises\nSource: American Society on Aging\n\n\n#homecare, #caregivers, #aginginplace, #healthcare, #economy, #wellbeing\n"
        ]
    ]
}