{
    "seed": "How cannabis impact your learning and memory?",
    "output": "output/instagram/ideas/2023-12-09-21-30-52-cannabis-impact-on-economy",
    "ideas": [
        {
            "first_page": {
                "image": "https://example.com/cannabis_economy.jpg",
                "image_alt": "Image of a cannabis plant with dollar signs in the background",
                "title": "The Impact of Cannabis on the Economy \ud83d\udcb0"
            },
            "pages": [
                {
                    "image": "https://example.com/cannabis_jobs.jpg",
                    "image_alt": "Image of people working in a cannabis cultivation facility",
                    "title": "Job Creation \ud83e\uddd1\u200d\ud83c\udf3e",
                    "text": "The cannabis industry has been a significant contributor to job creation. Legalization has opened up opportunities for various roles, including cultivation, processing, distribution, and retail. In states where cannabis is legal, thousands of jobs have been created, providing employment for individuals from diverse backgrounds.",
                    "footer": "Source: Cannabis Business Times"
                },
                {
                    "image": "https://example.com/cannabis_taxes.jpg",
                    "image_alt": "Image of a tax form with cannabis leaves in the background",
                    "title": "Tax Revenue \ud83d\udcb8",
                    "text": "Legalized cannabis generates substantial tax revenue for states and governments. Taxation on cannabis sales, cultivation, and other related activities contribute to funding essential public services such as education, healthcare, and infrastructure. These tax revenues can have a significant positive impact on local and national economies.",
                    "footer": "Source: Forbes"
                },
                {
                    "image": "https://example.com/cannabis_tourism.jpg",
                    "image_alt": "Image of tourists visiting a cannabis dispensary",
                    "title": "Cannabis Tourism \ud83c\udf34",
                    "text": "The legalization of cannabis has also led to the growth of cannabis tourism. People from around the world visit locations where cannabis is legal to explore the industry, participate in cannabis-related activities, and experience the culture. This influx of tourists boosts local economies by increasing tourism revenue, creating jobs, and supporting related industries.",
                    "footer": "Source: The New York Times"
                },
                {
                    "image": "https://example.com/cannabis_investments.jpg",
                    "image_alt": "Image of a graph showing increasing investments in the cannabis industry",
                    "title": "Investment Opportunities \ud83d\udcc8",
                    "text": "The cannabis industry presents attractive investment opportunities. As legalization expands, more investors are entering the market, leading to increased capital flow. Investments in cannabis companies, cultivation facilities, technology, and research contribute to economic growth and innovation.",
                    "footer": "Source: CNBC"
                },
                {
                    "image": "https://example.com/cannabis_industry.jpg",
                    "image_alt": "Image of a diverse group of people working in the cannabis industry",
                    "title": "Economic Empowerment \ud83d\udc65",
                    "text": "The cannabis industry has the potential to empower marginalized communities. By providing opportunities for ownership, employment, and entrepreneurship, it can address social and economic disparities. Supporting equity programs and initiatives within the cannabis industry can lead to more inclusive economic growth.",
                    "footer": "Source: Marijuana Business Daily"
                },
                {
                    "image": "https://example.com/cannabis_research.jpg",
                    "image_alt": "Image of scientists conducting research on cannabis",
                    "title": "Research and Innovation \ud83e\uddea",
                    "text": "The legalization of cannabis has fueled research and innovation in various fields. Scientists are studying the plant's medicinal properties, exploring new cultivation techniques, and developing innovative cannabis-based products. This research and innovation contribute to advancements in healthcare, agriculture, and other industries.",
                    "footer": "Source: National Institutes of Health"
                }
            ],
            "keywords": [
                "#cannabis",
                "#cannabiscommunity",
                "#cannabisculture",
                "#cannabiseducation",
                "#cannabisimpact",
                "#economy",
                "#jobcreation",
                "#taxrevenue",
                "#cannabistourism",
                "#investmentopportunities",
                "#economicempowerment",
                "#researchandinnovation"
            ]
        }
    ],
    "posts": [
        {
            "first_page": "output\\instagram\\ideas\\2023-12-09-21-30-52-cannabis-impact-on-economy\\idea-0-page-0-post.png",
            "pages": [
                "output\\instagram\\ideas\\2023-12-09-21-30-52-cannabis-impact-on-economy\\idea-0-page-1-post.png",
                "output\\instagram\\ideas\\2023-12-09-21-30-52-cannabis-impact-on-economy\\idea-0-page-2-post.png",
                "output\\instagram\\ideas\\2023-12-09-21-30-52-cannabis-impact-on-economy\\idea-0-page-3-post.png",
                "output\\instagram\\ideas\\2023-12-09-21-30-52-cannabis-impact-on-economy\\idea-0-page-4-post.png",
                "output\\instagram\\ideas\\2023-12-09-21-30-52-cannabis-impact-on-economy\\idea-0-page-5-post.png",
                "output\\instagram\\ideas\\2023-12-09-21-30-52-cannabis-impact-on-economy\\idea-0-page-6-post.png"
            ]
        }
    ],
    "summary": [
        [
            "The Impact of Cannabis on the Economy \ud83d\udcb0\nhttps://example.com/cannabis_economy.jpg\nImage of a cannabis plant with dollar signs in the background\n\nJob Creation \ud83e\uddd1\u200d\ud83c\udf3e\nThe cannabis industry has been a significant contributor to job creation. Legalization has opened up opportunities for various roles, including cultivation, processing, distribution, and retail. In states where cannabis is legal, thousands of jobs have been created, providing employment for individuals from diverse backgrounds.\nhttps://example.com/cannabis_jobs.jpg\nImage of people working in a cannabis cultivation facility\nSource: Cannabis Business Times\n\nTax Revenue \ud83d\udcb8\nLegalized cannabis generates substantial tax revenue for states and governments. Taxation on cannabis sales, cultivation, and other related activities contribute to funding essential public services such as education, healthcare, and infrastructure. These tax revenues can have a significant positive impact on local and national economies.\nhttps://example.com/cannabis_taxes.jpg\nImage of a tax form with cannabis leaves in the background\nSource: Forbes\n\nCannabis Tourism \ud83c\udf34\nThe legalization of cannabis has also led to the growth of cannabis tourism. People from around the world visit locations where cannabis is legal to explore the industry, participate in cannabis-related activities, and experience the culture. This influx of tourists boosts local economies by increasing tourism revenue, creating jobs, and supporting related industries.\nhttps://example.com/cannabis_tourism.jpg\nImage of tourists visiting a cannabis dispensary\nSource: The New York Times\n\nInvestment Opportunities \ud83d\udcc8\nThe cannabis industry presents attractive investment opportunities. As legalization expands, more investors are entering the market, leading to increased capital flow. Investments in cannabis companies, cultivation facilities, technology, and research contribute to economic growth and innovation.\nhttps://example.com/cannabis_investments.jpg\nImage of a graph showing increasing investments in the cannabis industry\nSource: CNBC\n\nEconomic Empowerment \ud83d\udc65\nThe cannabis industry has the potential to empower marginalized communities. By providing opportunities for ownership, employment, and entrepreneurship, it can address social and economic disparities. Supporting equity programs and initiatives within the cannabis industry can lead to more inclusive economic growth.\nhttps://example.com/cannabis_industry.jpg\nImage of a diverse group of people working in the cannabis industry\nSource: Marijuana Business Daily\n\nResearch and Innovation \ud83e\uddea\nThe legalization of cannabis has fueled research and innovation in various fields. Scientists are studying the plant's medicinal properties, exploring new cultivation techniques, and developing innovative cannabis-based products. This research and innovation contribute to advancements in healthcare, agriculture, and other industries.\nhttps://example.com/cannabis_research.jpg\nImage of scientists conducting research on cannabis\nSource: National Institutes of Health\n\n\n#cannabis, #cannabiscommunity, #cannabisculture, #cannabiseducation, #cannabisimpact, #economy, #jobcreation, #taxrevenue, #cannabistourism, #investmentopportunities, #economicempowerment, #researchandinnovation\n"
        ]
    ]
}