{
    "seed": "How to use localization as a tool for expansion on the gaming industry?",
    "output": "output/instagram/ideas/2023-12-09-22-04-43-how-to-use-localization-as-a-tool-for-expansion-on-the-gaming-industry",
    "ideas": [
        {
            "first_page": {
                "image": "https://example.com/localization-gaming.jpg",
                "image_alt": "Image of a person playing a video game with a world map in the background",
                "title": "Localization: A Tool for Expansion in the Gaming Industry"
            },
            "pages": [
                {
                    "image": "https://example.com/localization-definition.jpg",
                    "image_alt": "Image showing the word 'Localization' with a magnifying glass",
                    "title": "What is Localization?",
                    "text": "Localization refers to the process of adapting a product or content to a specific region or market. In the gaming industry, localization involves translating the game's text, audio, and cultural references to make it accessible and appealing to players in different countries.",
                    "footer": "Source: [Game Localization: Translating Games for Global Markets](https://www.gamasutra.com/blogs/AndresGomez/20131101/203841/Game_Localization_Translating_Games_for_Global_Markets.php)"
                },
                {
                    "image": "https://example.com/localization-benefits.jpg",
                    "image_alt": "Image of a world map with flags representing different countries",
                    "title": "Benefits of Localization",
                    "text": "1. Market Expansion: By localizing a game, developers can tap into new markets and reach a wider audience. It allows them to cater to the preferences and cultural nuances of players in different regions.\n\n2. Increased Revenue: Localization can significantly boost game sales and revenue. Studies have shown that players are more likely to purchase and engage with a game that is available in their native language.\n\n3. Player Engagement: Localization enhances player engagement by providing a more immersive and relatable gaming experience. Players feel more connected when they can understand the game's storyline, dialogues, and instructions.\n\n4. Cultural Sensitivity: Localization ensures that a game respects cultural sensitivities and avoids any unintentional offense. Adapting content to local customs, traditions, and references helps create a more inclusive and enjoyable gaming experience.",
                    "footer": "Source: [The Importance of Localization in the Gaming Industry](https://www.oneskyapp.com/blog/the-importance-of-localization-in-the-gaming-industry/)"
                },
                {
                    "image": "https://example.com/localization-process.jpg",
                    "image_alt": "Image of a person translating text on a computer",
                    "title": "The Localization Process",
                    "text": "1. Translation: The first step is translating the game's text, including dialogues, menus, tutorials, and subtitles, into the target language. It requires skilled translators who are familiar with gaming terminology and cultural nuances.\n\n2. Audio Localization: If the game has voice-overs or narrations, they need to be translated and recorded by native speakers. Lip-syncing and timing are crucial to ensure a seamless audio experience.\n\n3. Cultural Adaptation: Content is adapted to suit the target culture, including changing references, symbols, and visuals that may not resonate with the local audience.\n\n4. Testing and Quality Assurance: The localized game undergoes rigorous testing to ensure accuracy, functionality, and linguistic integrity. Any issues or bugs are addressed before the final release.",
                    "footer": "Source: [The Localization Process in the Video Game Industry](https://www.lionbridge.com/blog/translation-and-localization/the-localization-process-in-the-video-game-industry/)"
                },
                {
                    "image": "https://example.com/localization-tips.jpg",
                    "image_alt": "Image of a person holding a globe and a checklist",
                    "title": "Tips for Effective Localization",
                    "text": "1. Research Target Market: Understand the cultural, linguistic, and gaming preferences of the target market to ensure accurate localization.\n\n2. Collaborate with Native Speakers: Work with native speakers who have gaming expertise to ensure accurate translations and cultural adaptations.\n\n3. Plan Ahead: Incorporate localization considerations in the game development process from the beginning. This reduces costs and avoids potential issues later.\n\n4. Localization Testing: Conduct thorough testing with players from the target market to identify any linguistic or cultural issues that need to be addressed.\n\n5. Post-Launch Support: Provide ongoing support and updates to address any localization issues that may arise after the game's release.",
                    "footer": "Source: [Game Localization: Tips for Success](https://www.gamasutra.com/blogs/AndresGomez/20131108/203912/Game_Localization_Tips_for_Success.php)"
                }
            ],
            "keywords": [
                "#Localization",
                "#GamingIndustry",
                "#MarketExpansion",
                "#IncreasedRevenue",
                "#PlayerEngagement",
                "#CulturalSensitivity",
                "#LocalizationProcess",
                "#TipsForLocalization"
            ]
        }
    ],
    "posts": [
        {
            "first_page": "output\\instagram\\ideas\\2023-12-09-22-04-43-how-to-use-localization-as-a-tool-for-expansion-on-the-gaming-industry\\idea-0-page-0-post.png",
            "pages": [
                "output\\instagram\\ideas\\2023-12-09-22-04-43-how-to-use-localization-as-a-tool-for-expansion-on-the-gaming-industry\\idea-0-page-1-post.png",
                "output\\instagram\\ideas\\2023-12-09-22-04-43-how-to-use-localization-as-a-tool-for-expansion-on-the-gaming-industry\\idea-0-page-2-post.png",
                "output\\instagram\\ideas\\2023-12-09-22-04-43-how-to-use-localization-as-a-tool-for-expansion-on-the-gaming-industry\\idea-0-page-3-post.png",
                "output\\instagram\\ideas\\2023-12-09-22-04-43-how-to-use-localization-as-a-tool-for-expansion-on-the-gaming-industry\\idea-0-page-4-post.png"
            ]
        }
    ],
    "summary": [
        [
            "Localization: A Tool for Expansion in the Gaming Industry\nhttps://example.com/localization-gaming.jpg\nImage of a person playing a video game with a world map in the background\n\nWhat is Localization?\nLocalization refers to the process of adapting a product or content to a specific region or market. In the gaming industry, localization involves translating the game's text, audio, and cultural references to make it accessible and appealing to players in different countries.\nhttps://example.com/localization-definition.jpg\nImage showing the word 'Localization' with a magnifying glass\nSource: [Game Localization: Translating Games for Global Markets](https://www.gamasutra.com/blogs/AndresGomez/20131101/203841/Game_Localization_Translating_Games_for_Global_Markets.php)\n\nBenefits of Localization\n1. Market Expansion: By localizing a game, developers can tap into new markets and reach a wider audience. It allows them to cater to the preferences and cultural nuances of players in different regions.\n\n2. Increased Revenue: Localization can significantly boost game sales and revenue. Studies have shown that players are more likely to purchase and engage with a game that is available in their native language.\n\n3. Player Engagement: Localization enhances player engagement by providing a more immersive and relatable gaming experience. Players feel more connected when they can understand the game's storyline, dialogues, and instructions.\n\n4. Cultural Sensitivity: Localization ensures that a game respects cultural sensitivities and avoids any unintentional offense. Adapting content to local customs, traditions, and references helps create a more inclusive and enjoyable gaming experience.\nhttps://example.com/localization-benefits.jpg\nImage of a world map with flags representing different countries\nSource: [The Importance of Localization in the Gaming Industry](https://www.oneskyapp.com/blog/the-importance-of-localization-in-the-gaming-industry/)\n\nThe Localization Process\n1. Translation: The first step is translating the game's text, including dialogues, menus, tutorials, and subtitles, into the target language. It requires skilled translators who are familiar with gaming terminology and cultural nuances.\n\n2. Audio Localization: If the game has voice-overs or narrations, they need to be translated and recorded by native speakers. Lip-syncing and timing are crucial to ensure a seamless audio experience.\n\n3. Cultural Adaptation: Content is adapted to suit the target culture, including changing references, symbols, and visuals that may not resonate with the local audience.\n\n4. Testing and Quality Assurance: The localized game undergoes rigorous testing to ensure accuracy, functionality, and linguistic integrity. Any issues or bugs are addressed before the final release.\nhttps://example.com/localization-process.jpg\nImage of a person translating text on a computer\nSource: [The Localization Process in the Video Game Industry](https://www.lionbridge.com/blog/translation-and-localization/the-localization-process-in-the-video-game-industry/)\n\nTips for Effective Localization\n1. Research Target Market: Understand the cultural, linguistic, and gaming preferences of the target market to ensure accurate localization.\n\n2. Collaborate with Native Speakers: Work with native speakers who have gaming expertise to ensure accurate translations and cultural adaptations.\n\n3. Plan Ahead: Incorporate localization considerations in the game development process from the beginning. This reduces costs and avoids potential issues later.\n\n4. Localization Testing: Conduct thorough testing with players from the target market to identify any linguistic or cultural issues that need to be addressed.\n\n5. Post-Launch Support: Provide ongoing support and updates to address any localization issues that may arise after the game's release.\nhttps://example.com/localization-tips.jpg\nImage of a person holding a globe and a checklist\nSource: [Game Localization: Tips for Success](https://www.gamasutra.com/blogs/AndresGomez/20131108/203912/Game_Localization_Tips_for_Success.php)\n\n\n#Localization, #GamingIndustry, #MarketExpansion, #IncreasedRevenue, #PlayerEngagement, #CulturalSensitivity, #LocalizationProcess, #TipsForLocalization\n"
        ]
    ]
}