{
    "seed": "How to use localization as a tool for expansion on the gaming industry?",
    "output": "output/instagram/ideas/2023-12-09-22-06-37-how-to-use-localization-as-a-tool-for-expansion-on-the-gaming-industry",
    "ideas": [
        {
            "first_page": {
                "image": "IMAGE_URL",
                "image_alt": "Illustration of a globe with gaming icons around it",
                "title": "Localization: A Tool for Expansion in the Gaming Industry"
            },
            "pages": [
                {
                    "image": "IMAGE_URL",
                    "image_alt": "Illustration of a game controller with flags representing different countries",
                    "title": "What is Localization?",
                    "text": "Localization refers to the process of adapting a product or service to a specific language, culture, and target market. In the gaming industry, localization involves translating and adapting video games to make them culturally relevant and appealing to players in different regions.",
                    "footer": "Source: [Reference 1]"
                },
                {
                    "image": "IMAGE_URL",
                    "image_alt": "Illustration of a world map with gaming icons representing different countries",
                    "title": "Why is Localization Important?",
                    "text": "Localization is crucial for the success of gaming companies looking to expand their reach globally. By localizing their games, companies can overcome language barriers, cater to cultural preferences, and provide an immersive gaming experience to players worldwide. It helps in creating a connection with players, increasing player engagement, and ultimately driving revenue.",
                    "footer": "Source: [Reference 2]"
                },
                {
                    "image": "IMAGE_URL",
                    "image_alt": "Illustration of a game character with speech bubbles in different languages",
                    "title": "Key Elements of Localization",
                    "text": "Localization involves various elements, including:\n\n1. Translation: Translating in-game text, dialogues, and instructions into the target language.\n2. Cultural Adaptation: Adapting visuals, symbols, and references to align with the target culture.\n3. Audio Localization: Recording voice-overs in the target language to enhance the gaming experience.\n4. User Interface (UI) Localization: Adapting menus, buttons, and navigation to suit the target language and cultural preferences.\n5. Legal and Regulatory Compliance: Ensuring compliance with local laws and regulations, including age ratings and content restrictions.",
                    "footer": "Source: [Reference 3]"
                },
                {
                    "image": "IMAGE_URL",
                    "image_alt": "Illustration of gamers from different countries playing together",
                    "title": "Benefits of Localization",
                    "text": "1. Global Market Expansion: Localization allows gaming companies to tap into new markets and reach a wider audience.\n2. Increased Revenue: By catering to the preferences of players in different regions, companies can boost sales and generate higher revenue.\n3. Enhanced Player Experience: Localization creates a more immersive and enjoyable experience for players by providing content in their native language.\n4. Cultural Sensitivity: Adapting games to local cultures shows respect and understanding, fostering positive relationships with players.",
                    "footer": "Source: [Reference 4]"
                },
                {
                    "image": "IMAGE_URL",
                    "image_alt": "Illustration of a game controller with a world map and currency symbols",
                    "title": "Challenges in Localization",
                    "text": "While localization offers numerous benefits, it also comes with challenges:\n\n1. Linguistic and Cultural Nuances: Translating idioms, jokes, and cultural references accurately can be challenging.\n2. Technical Limitations: Adapting complex game mechanics and UI elements to different languages and character sets may require extensive development work.\n3. Time and Cost: Localization can be time-consuming and costly, especially for large-scale games with extensive content.\n4. Quality Assurance: Ensuring the quality and consistency of the localized content across different platforms and devices.",
                    "footer": "Source: [Reference 5]"
                },
                {
                    "image": "IMAGE_URL",
                    "image_alt": "Illustration of gamers from different countries collaborating on game development",
                    "title": "Best Practices for Localization",
                    "text": "To achieve effective localization, gaming companies should:\n\n1. Plan Ahead: Incorporate localization considerations early in the game development process.\n2. Work with Professional Localization Partners: Collaborate with experienced localization agencies or professionals who understand the gaming industry and target markets.\n3. Conduct Market Research: Gain insights into the preferences, cultural nuances, and gaming habits of the target audience.\n4. Test and Iterate: Conduct thorough testing and gather feedback from players in different regions to refine the localized version.\n5. Maintain Ongoing Support: Provide updates, bug fixes, and localized content updates to keep players engaged.",
                    "footer": "Source: [Reference 6]"
                },
                {
                    "image": "IMAGE_URL",
                    "image_alt": "Illustration of a gamer holding a smartphone with gaming icons representing different genres",
                    "title": "Conclusion",
                    "text": "Localization plays a vital role in the expansion of the gaming industry. By adapting games to different languages and cultures, companies can unlock new markets, increase player engagement, and drive revenue. It is important for gaming companies to invest in effective localization strategies to cater to the diverse needs and preferences of players worldwide.",
                    "footer": "Source: [Reference 7]"
                }
            ],
            "keywords": [
                "#Localization",
                "#GamingIndustry",
                "#GlobalExpansion",
                "#PlayerExperience",
                "#CulturalAdaptation"
            ]
        }
    ],
    "posts": [
        {
            "first_page": "output\\instagram\\ideas\\2023-12-09-22-06-37-how-to-use-localization-as-a-tool-for-expansion-on-the-gaming-industry\\idea-0-page-0-post.png",
            "pages": [
                "output\\instagram\\ideas\\2023-12-09-22-06-37-how-to-use-localization-as-a-tool-for-expansion-on-the-gaming-industry\\idea-0-page-1-post.png",
                "output\\instagram\\ideas\\2023-12-09-22-06-37-how-to-use-localization-as-a-tool-for-expansion-on-the-gaming-industry\\idea-0-page-2-post.png",
                "output\\instagram\\ideas\\2023-12-09-22-06-37-how-to-use-localization-as-a-tool-for-expansion-on-the-gaming-industry\\idea-0-page-3-post.png",
                "output\\instagram\\ideas\\2023-12-09-22-06-37-how-to-use-localization-as-a-tool-for-expansion-on-the-gaming-industry\\idea-0-page-4-post.png",
                "output\\instagram\\ideas\\2023-12-09-22-06-37-how-to-use-localization-as-a-tool-for-expansion-on-the-gaming-industry\\idea-0-page-5-post.png",
                "output\\instagram\\ideas\\2023-12-09-22-06-37-how-to-use-localization-as-a-tool-for-expansion-on-the-gaming-industry\\idea-0-page-6-post.png",
                "output\\instagram\\ideas\\2023-12-09-22-06-37-how-to-use-localization-as-a-tool-for-expansion-on-the-gaming-industry\\idea-0-page-7-post.png"
            ]
        }
    ],
    "summary": [
        [
            "Localization: A Tool for Expansion in the Gaming Industry\nIMAGE_URL\nIllustration of a globe with gaming icons around it\n\nWhat is Localization?\nLocalization refers to the process of adapting a product or service to a specific language, culture, and target market. In the gaming industry, localization involves translating and adapting video games to make them culturally relevant and appealing to players in different regions.\nIMAGE_URL\nIllustration of a game controller with flags representing different countries\nSource: [Reference 1]\n\nWhy is Localization Important?\nLocalization is crucial for the success of gaming companies looking to expand their reach globally. By localizing their games, companies can overcome language barriers, cater to cultural preferences, and provide an immersive gaming experience to players worldwide. It helps in creating a connection with players, increasing player engagement, and ultimately driving revenue.\nIMAGE_URL\nIllustration of a world map with gaming icons representing different countries\nSource: [Reference 2]\n\nKey Elements of Localization\nLocalization involves various elements, including:\n\n1. Translation: Translating in-game text, dialogues, and instructions into the target language.\n2. Cultural Adaptation: Adapting visuals, symbols, and references to align with the target culture.\n3. Audio Localization: Recording voice-overs in the target language to enhance the gaming experience.\n4. User Interface (UI) Localization: Adapting menus, buttons, and navigation to suit the target language and cultural preferences.\n5. Legal and Regulatory Compliance: Ensuring compliance with local laws and regulations, including age ratings and content restrictions.\nIMAGE_URL\nIllustration of a game character with speech bubbles in different languages\nSource: [Reference 3]\n\nBenefits of Localization\n1. Global Market Expansion: Localization allows gaming companies to tap into new markets and reach a wider audience.\n2. Increased Revenue: By catering to the preferences of players in different regions, companies can boost sales and generate higher revenue.\n3. Enhanced Player Experience: Localization creates a more immersive and enjoyable experience for players by providing content in their native language.\n4. Cultural Sensitivity: Adapting games to local cultures shows respect and understanding, fostering positive relationships with players.\nIMAGE_URL\nIllustration of gamers from different countries playing together\nSource: [Reference 4]\n\nChallenges in Localization\nWhile localization offers numerous benefits, it also comes with challenges:\n\n1. Linguistic and Cultural Nuances: Translating idioms, jokes, and cultural references accurately can be challenging.\n2. Technical Limitations: Adapting complex game mechanics and UI elements to different languages and character sets may require extensive development work.\n3. Time and Cost: Localization can be time-consuming and costly, especially for large-scale games with extensive content.\n4. Quality Assurance: Ensuring the quality and consistency of the localized content across different platforms and devices.\nIMAGE_URL\nIllustration of a game controller with a world map and currency symbols\nSource: [Reference 5]\n\nBest Practices for Localization\nTo achieve effective localization, gaming companies should:\n\n1. Plan Ahead: Incorporate localization considerations early in the game development process.\n2. Work with Professional Localization Partners: Collaborate with experienced localization agencies or professionals who understand the gaming industry and target markets.\n3. Conduct Market Research: Gain insights into the preferences, cultural nuances, and gaming habits of the target audience.\n4. Test and Iterate: Conduct thorough testing and gather feedback from players in different regions to refine the localized version.\n5. Maintain Ongoing Support: Provide updates, bug fixes, and localized content updates to keep players engaged.\nIMAGE_URL\nIllustration of gamers from different countries collaborating on game development\nSource: [Reference 6]\n\nConclusion\nLocalization plays a vital role in the expansion of the gaming industry. By adapting games to different languages and cultures, companies can unlock new markets, increase player engagement, and drive revenue. It is important for gaming companies to invest in effective localization strategies to cater to the diverse needs and preferences of players worldwide.\nIMAGE_URL\nIllustration of a gamer holding a smartphone with gaming icons representing different genres\nSource: [Reference 7]\n\n\n#Localization, #GamingIndustry, #GlobalExpansion, #PlayerExperience, #CulturalAdaptation\n"
        ]
    ]
}